{
  "$schema": "https://json-schema.org/draft/2020-12/schema",
  "title": "Tongji Calculus Chapter 5 bilingual question",
  "type": "object",
  "required": [
    "id",
    "section",
    "tier",
    "difficulty",
    "type",
    "tags",
    "minutes",
    "space",
    "classic_method",
    "source_lineage",
    "zh",
    "en"
  ],
  "properties": {
    "id": {"type": "string", "pattern": "^Q[0-9]{3}$"},
    "section": {"type": "integer", "minimum": 1, "maximum": 5},
    "tier": {
      "enum": ["foundation", "methods", "synthesis", "challenge"]
    },
    "difficulty": {
      "enum": ["basic", "standard", "advanced", "hard", "challenge"]
    },
    "type": {
      "enum": [
        "single_choice",
        "multiple_choice",
        "true_false",
        "fill_blank",
        "calculation",
        "proof",
        "comprehensive",
        "error_diagnosis"
      ]
    },
    "tags": {
      "type": "object",
      "required": ["zh", "en"],
      "properties": {
        "zh": {"type": "array", "items": {"type": "string"}, "minItems": 1},
        "en": {"type": "array", "items": {"type": "string"}, "minItems": 1}
      }
    },
    "minutes": {"type": "integer", "minimum": 2, "maximum": 45},
    "space": {"enum": ["S", "M", "L", "XL"]},
    "classic_method": {"type": "boolean"},
    "source_lineage": {"$ref": "#/$defs/source_lineage"},
    "zh": {"$ref": "#/$defs/localized"},
    "en": {"$ref": "#/$defs/localized"}
  },
  "$defs": {
    "source_lineage": {
      "type": "object",
      "additionalProperties": false,
      "required": ["category", "method_family", "relation", "references"],
      "properties": {
        "category": {
          "enum": [
            "open_text_adaptation",
            "classic_method_variant",
            "original_synthesis"
          ]
        },
        "method_family": {
          "enum": [
            "riemann_sums_and_definition",
            "definite_integral_properties",
            "integral_mean_value_and_average",
            "fundamental_theorem_and_new_functions",
            "newton_leibniz_evaluation",
            "definite_integral_substitution",
            "definite_integral_by_parts",
            "improper_integral_infinite_interval",
            "improper_integral_singular_endpoint",
            "improper_integral_interior_singularity",
            "improper_integral_convergence_tests",
            "gamma_function_enrichment"
          ]
        },
        "relation": {
          "enum": [
            "adapted_from_open_text_topic_and_method",
            "independently_rewritten_classic_method_variant",
            "independently_synthesized_from_standard_methods"
          ]
        },
        "references": {
          "type": "array",
          "minItems": 1,
          "uniqueItems": true,
          "items": {
            "enum": [
              "openstax-calculus-v1-5.2",
              "openstax-calculus-v1-5.3",
              "openstax-calculus-v1-5.5",
              "openstax-calculus-v2-3.1",
              "openstax-calculus-v2-3.7",
              "mit-18.01sc-definite-integral",
              "mit-18.01sc-improper-integrals",
              "mit-18.100a-gamma"
            ]
          }
        }
      }
    },
    "localized": {
      "type": "object",
      "required": ["title", "prompt", "answer", "solution"],
      "properties": {
        "title": {"type": "string", "minLength": 2},
        "prompt": {"type": "string", "minLength": 4},
        "choices": {"type": "array", "items": {"type": "string"}},
        "answer": {"type": "string", "minLength": 1},
        "solution": {
          "type": "object",
          "required": [
            "knowledge",
            "analysis",
            "steps",
            "pitfalls",
            "verification",
            "takeaway",
            "extension"
          ],
          "properties": {
            "knowledge": {
              "type": "array",
              "items": {"type": "string"},
              "minItems": 1
            },
            "analysis": {"type": "string", "minLength": 8},
            "steps": {
              "type": "array",
              "items": {"type": "string"},
              "minItems": 2
            },
            "pitfalls": {
              "type": "array",
              "items": {"type": "string"},
              "minItems": 1
            },
            "verification": {"type": "string", "minLength": 4},
            "takeaway": {"type": "string", "minLength": 4},
            "extension": {"type": "string"}
          }
        }
      }
    }
  }
}
