[
  {
    "id": "Q051",
    "section": 3,
    "tier": "synthesis",
    "difficulty": "standard",
    "type": "fill_blank",
    "tags": {
      "zh": [
        "定积分换元法",
        "变量、微分与上下限同步变换",
        "换元后的端点方向"
      ],
      "en": [
        "substitution in definite integrals",
        "transforming the variable, differential, and limits together",
        "orientation of transformed limits"
      ]
    },
    "minutes": 7,
    "space": "M",
    "classic_method": true,
    "source_lineage": {
      "category": "open_text_adaptation",
      "method_family": "definite_integral_substitution",
      "relation": "adapted_from_open_text_topic_and_method",
      "references": [
        "mit-18.01sc-definite-integral",
        "openstax-calculus-v1-5.5"
      ]
    },
    "zh": {
      "title": "复合多项式换元",
      "prompt": "计算 $\\displaystyle \\int_0^1x(1+x^2)^2\\,dx=\\underline{\\qquad}$。",
      "answer": "$\\frac76$",
      "solution": {
        "knowledge": [
          "定积分换元法",
          "变量、微分与上下限同步变换",
          "换元后的端点方向"
        ],
        "analysis": "内层 $1+x^2$ 的微分与因子 $x\\,dx$ 只差常数；换元后得到一个可直接积分的二次幂。",
        "steps": [
          "令 $u=1+x^2$，则 $du=2x\\,dx$，即 $x\\,dx=\\frac12du$。",
          "当 $x=0$ 时 $u=1$；当 $x=1$ 时 $u=2$。",
          "原积分化为 $\\frac12\\int_1^2u^2\\,du$。",
          "因此结果为 $\\frac12\\left.\\frac{u^3}{3}\\right|_1^2=\\frac16(8-1)=\\frac76$。"
        ],
        "pitfalls": [
          "换元后混用新变量与旧上下限",
          "换元函数非一一时不分段就直接改限",
          "漏掉微分中的常数或负号"
        ],
        "verification": "展开得 $x(1+x^2)^2=x+2x^3+x^5$；逐项积分为 $\\frac12+2\\cdot\\frac14+\\frac16=\\frac76$，与换元结果一致。",
        "takeaway": "定积分换元必须让变量、微分和端点成为一个闭合系统；端点方向由换元自动决定。",
        "extension": "用原变量回代再代入原端点，可作为独立验算路线。"
      }
    },
    "en": {
      "title": "A Composite-Polynomial Substitution",
      "prompt": "Evaluate $\\displaystyle \\int_0^1x(1+x^2)^2\\,dx=\\underline{\\qquad}$.",
      "answer": "$\\frac76$",
      "solution": {
        "knowledge": [
          "substitution in definite integrals",
          "transforming the variable, differential, and limits together",
          "orientation of transformed limits"
        ],
        "analysis": "The differential of the inner expression $1+x^2$ differs from the factor $x\\,dx$ only by a constant, leaving a directly integrable square.",
        "steps": [
          "Set $u=1+x^2$, so $du=2x\\,dx$ and $x\\,dx=\\frac12du$.",
          "When $x=0$, $u=1$; when $x=1$, $u=2$.",
          "The integral becomes $\\frac12\\int_1^2u^2\\,du$.",
          "Therefore the value is $\\frac12\\left.\\frac{u^3}{3}\\right|_1^2=\\frac16(8-1)=\\frac76$."
        ],
        "pitfalls": [
          "mixing a new variable with old limits",
          "changing limits through a non-one-to-one map without splitting",
          "losing a constant or minus sign in the differential"
        ],
        "verification": "Expanding gives $x(1+x^2)^2=x+2x^3+x^5$; termwise integration gives $\\frac12+2\\cdot\\frac14+\\frac16=\\frac76$, confirming the substitution.",
        "takeaway": "A definite-integral substitution must transform the variable, differential, and endpoints as one coherent system; the substitution determines orientation.",
        "extension": "Back-substitute before evaluating at the original endpoints as an independent verification route."
      }
    }
  },
  {
    "id": "Q052",
    "section": 3,
    "tier": "synthesis",
    "difficulty": "standard",
    "type": "single_choice",
    "tags": {
      "zh": [
        "定积分换元法",
        "变量、微分与上下限同步变换",
        "换元后的端点方向"
      ],
      "en": [
        "substitution in definite integrals",
        "transforming the variable, differential, and limits together",
        "orientation of transformed limits"
      ]
    },
    "minutes": 6,
    "space": "S",
    "classic_method": true,
    "source_lineage": {
      "category": "open_text_adaptation",
      "method_family": "definite_integral_substitution",
      "relation": "adapted_from_open_text_topic_and_method",
      "references": [
        "mit-18.01sc-definite-integral",
        "openstax-calculus-v1-5.5"
      ]
    },
    "zh": {
      "title": "指数复合函数的定积分",
      "prompt": "积分 $\\displaystyle \\int_0^1 x e^{x^2}\\,dx$ 的值是哪一项？",
      "answer": "B",
      "solution": {
        "knowledge": [
          "定积分换元法",
          "变量、微分与上下限同步变换",
          "换元后的端点方向"
        ],
        "analysis": "令 $u=x^2$ 时微分只差常数因子 $\\frac12$；新端点仍为 $0$ 与 $1$。",
        "steps": [
          "令 $u=x^2$，则 $du=2x\\,dx$，所以 $x\\,dx=\\frac12du$。",
          "端点变换为 $x=0\\Rightarrow u=0$，$x=1\\Rightarrow u=1$。",
          "于是积分等于 $\\frac12\\int_0^1e^u\\,du$。",
          "计算得 $\\frac12\\left(e-1\\right)$，故选择 B。"
        ],
        "pitfalls": [
          "换元后混用新变量与旧上下限",
          "换元函数非一一时不分段就直接改限",
          "漏掉微分中的常数或负号"
        ],
        "verification": "因 $x e^{x^2}<e$ 且区间长度为 $1$，结果应小于 $e$；$\\frac{e-1}{2}$ 满足该估计。",
        "takeaway": "定积分换元必须让变量、微分和端点成为一个闭合系统；端点方向由换元自动决定。",
        "extension": "用原变量回代再代入原端点，可作为独立验算路线。"
      },
      "choices": [
        "A. $e-1$",
        "B. $\\frac{e-1}{2}$",
        "C. $\\frac{e}{2}$",
        "D. $\\frac12$"
      ]
    },
    "en": {
      "title": "A Definite Integral of an Exponential Composite",
      "prompt": "Which value equals $\\displaystyle \\int_0^1 x e^{x^2}\\,dx$?",
      "answer": "B",
      "solution": {
        "knowledge": [
          "substitution in definite integrals",
          "transforming the variable, differential, and limits together",
          "orientation of transformed limits"
        ],
        "analysis": "With $u=x^2$, the differential contributes the factor $\\frac12$, and the new endpoints remain $0$ and $1$.",
        "steps": [
          "Let $u=x^2$, so $du=2x\\,dx$ and $x\\,dx=\\frac12du$.",
          "The endpoints become $x=0\\Rightarrow u=0$ and $x=1\\Rightarrow u=1$.",
          "Thus the integral is $\\frac12\\int_0^1e^u\\,du$.",
          "Its value is $\\frac12(e-1)$, so B is correct."
        ],
        "pitfalls": [
          "mixing a new variable with old limits",
          "changing limits through a non-one-to-one map without splitting",
          "losing a constant or minus sign in the differential"
        ],
        "verification": "Since $x e^{x^2}<e$ on an interval of length $1$, the result must be below $e$; $\\frac{e-1}{2}$ satisfies this bound.",
        "takeaway": "A definite-integral substitution must transform the variable, differential, and endpoints as one coherent system; the substitution determines orientation.",
        "extension": "Back-substitute before evaluating at the original endpoints as an independent verification route."
      },
      "choices": [
        "A. $e-1$",
        "B. $\\frac{e-1}{2}$",
        "C. $\\frac{e}{2}$",
        "D. $\\frac12$"
      ]
    }
  },
  {
    "id": "Q053",
    "section": 3,
    "tier": "synthesis",
    "difficulty": "standard",
    "type": "multiple_choice",
    "tags": {
      "zh": [
        "定积分换元法",
        "变量、微分与上下限同步变换",
        "换元后的端点方向"
      ],
      "en": [
        "substitution in definite integrals",
        "transforming the variable, differential, and limits together",
        "orientation of transformed limits"
      ]
    },
    "minutes": 9,
    "space": "S",
    "classic_method": false,
    "source_lineage": {
      "category": "original_synthesis",
      "method_family": "definite_integral_substitution",
      "relation": "independently_synthesized_from_standard_methods",
      "references": [
        "mit-18.01sc-definite-integral"
      ]
    },
    "zh": {
      "title": "换元与端点一致性辨析",
      "prompt": "下列换元结果中，哪些完全正确？假设出现的 $f$ 连续。",
      "answer": "A、B、D。",
      "solution": {
        "knowledge": [
          "定积分换元法",
          "变量、微分与上下限同步变换",
          "换元后的端点方向"
        ],
        "analysis": "逐项检查微分因子、端点及变量是否统一；等式数值偶然相同也不能替代合法的换元过程。",
        "steps": [
          "A 中令 $u=x^2$，$du=2x\\,dx$，端点 $0,1$ 不变，故 A 正确。",
          "B 中令 $u=\\ln x$，$du=\\frac{dx}{x}$，端点 $1,e$ 变为 $0,1$，故 B 正确。",
          "C 中令 $u=\\cos x$ 时 $du=-\\sin x\\,dx$；若保持端点 $1,0$，积分前必须有负号，所以 C 错误。",
          "D 中令 $u=\\frac{x}{a}$，则 $dx=a\\,du$；在 $a>0$ 下端点 $0,a$ 变为 $0,1$，故 D 正确。"
        ],
        "pitfalls": [
          "换元后混用新变量与旧上下限",
          "换元函数非一一时不分段就直接改限",
          "漏掉微分中的常数或负号"
        ],
        "verification": "对 C 直接计算：左侧为 $1$，而写出的右侧 $\\int_1^0du=-1$，明确暴露负号错误。",
        "takeaway": "定积分换元必须让变量、微分和端点成为一个闭合系统；端点方向由换元自动决定。",
        "extension": "用原变量回代再代入原端点，可作为独立验算路线。"
      },
      "choices": [
        "A. $\\displaystyle \\int_0^1 2x f(x^2)\\,dx=\\int_0^1f(u)\\,du$",
        "B. $\\displaystyle \\int_1^e\\frac{f(\\ln x)}{x}\\,dx=\\int_0^1f(u)\\,du$",
        "C. 令 $u=\\cos x$，则 $\\displaystyle \\int_0^{\\frac\\pi2}\\sin x\\,dx=\\int_1^0du$",
        "D. 若 $a>0$，则 $\\displaystyle \\int_0^a f\\!\\left(\\frac{x}{a}\\right)\\,dx=a\\int_0^1f(u)\\,du$"
      ]
    },
    "en": {
      "title": "Consistency of Substitution and Endpoints",
      "prompt": "Which substitution results are fully correct? Assume every displayed $f$ is continuous.",
      "answer": "A, B, and D.",
      "solution": {
        "knowledge": [
          "substitution in definite integrals",
          "transforming the variable, differential, and limits together",
          "orientation of transformed limits"
        ],
        "analysis": "For each choice, check the differential factor, endpoints, and variable consistency; accidental numerical equality cannot replace a valid substitution.",
        "steps": [
          "In A, $u=x^2$ gives $du=2x\\,dx$ and leaves the endpoints $0,1$, so A is correct.",
          "In B, $u=\\ln x$ gives $du=\\frac{dx}{x}$ and sends $1,e$ to $0,1$, so B is correct.",
          "In C, $u=\\cos x$ gives $du=-\\sin x\\,dx$; retaining endpoints $1,0$ requires a leading minus sign, so C is false.",
          "In D, $u=\\frac{x}{a}$ gives $dx=a\\,du$; for $a>0$, endpoints $0,a$ become $0,1$, so D is correct."
        ],
        "pitfalls": [